product_name,link,startech_rice,brand
Asrock H81M-VG4 R3.0 Super Alloy ATX Motherboard,https://www.startech.com.bd/asrock-h81m-vg4-r3-motherboard,"4,500",Asrock
ASUS EX-A320M AMD AM4 Socket Gaming Motherboard,https://www.startech.com.bd/asus-ex-a320m-gaming-motherboard,"7,200",ASUS
Asus H110M-CS 7th/6th Gen micro-ATX Motherboard,https://www.startech.com.bd/asus-h110m-cs-micro-atx-motherboard,"5,500",Asus
ASUS PRIME B450M-A AMD mATX Motherboard,https://www.startech.com.bd/asus-prime-b450m-a-amd-motherboard,"9,100",ASUS
Esonic G31 DDR2 motherboard ,https://www.startech.com.bd/esonic-g31-ddr2-motherboard ,"2,400",Esonic
Gigabyte B450M S2H ULTRA Durable Motherboard,https://www.startech.com.bd/gigabyte-b450m-s2h-ultra-durable-motherboard,"6,300",Gigabyte
Gigabyte GA-A320M-S2H AMD Micro ATX Motherboard,https://www.startech.com.bd/gigabyte-ga-a320m-s2h-amd-motherboard,"5,300",Gigabyte
Gigabyte GA-H110M-DS2 Micro ATX Motherboard,https://www.startech.com.bd/gigabyte-ga-h110m-ds2-motherboard,"5,300",Gigabyte
MSI B360M PRO-VDH 8th Gen DDR4 Motherboard ,https://www.startech.com.bd/msi-b360m-pro-vdh-motherboard,"7,900",MSI
MSI B360M PRO-VH DDR4 8th Gen Motherboard,https://www.startech.com.bd/msi-b360m-pro-vh-mainboard,"7,900",MSI
MSI H310M Gaming Arctic 8th Gen DDR4 Motherboard,https://www.startech.com.bd/msi-h310m-gaming-arctic-mohterboard,"8,200",MSI
Redfox Intel Chipset G31 Motherboard,https://www.startech.com.bd/redfox-intel-chipset-g31,"2,500",Redfox
ASRock A320M-HDV R4.0 AMD Motherboard,https://www.startech.com.bd/asrock-a320m-hdv-r4.0-amd-motherboard,"5,500",ASRock
ASRock H110M-HDV Micro ATX DDR4 Motherboard,https://www.startech.com.bd/asrock-h110m-hdv-motherboard,"5,300",ASRock
ASUS H81M-P,https://www.startech.com.bd/asus-h81m-p,"5,500",ASUS
Asus ROG STRIX B450-I GAMING AMD Mini ITX Motherboard,https://www.startech.com.bd/asus-rog-strix-b450-i-gaming-amd-mini-itx-motherboard,"16,100",Asus
Esonic G41 DDR3 Motherboard,https://www.startech.com.bd/esonic-g41-ddr3-motherboard,"2,900",Esonic
Gigabyte GA-H110M-DS2V Motherboard,https://www.startech.com.bd/gigabyte-ga-h110m-ds2v,"5,300",Gigabyte
Redfox Intel Chipset G41 DDR3 Motherboard,https://www.startech.com.bd/redfox-intel-chipset-g41,"3,000",Redfox
Asus H110M-E/M.2 DDR4 USB 3.0 ATX Motherboard,https://www.startech.com.bd/asus-h110m-e-m2-motherboard,"5,700",Asus
Asus ROG STRIX X470-F GAMING AMD ATX Motherboard,https://www.startech.com.bd/asus-rog-strix-x470-f-gaming-amd-motherboard,"20,900",Asus
Gigabyte GA-G41M-Combo Motherboard,https://www.startech.com.bd/gigabyte-ga-g41m-combo-motherboard,"5,700",Gigabyte
Gigabyte GA-H110M S2PH-DDR4,https://www.startech.com.bd/Gigabyte-GA-H110M-S2PH-DDR4 ,"5,700",Gigabyte
ASRock B450M-HDV R4.0 AMD Motherboard,https://www.startech.com.bd/asrock-b450m-hdv-r4-amd-motherboard,"6,300",ASRock
Asrock H310CM-HDV/M.2 8th & 9th Gen DDR4 Motherboard,https://www.startech.com.bd/asrock-h310cm-hdv-m.2-motherboard,"6,400",Asrock
Asrock H310M-HDV/M.2 8th Gen DDR4 Motherboard,https://www.startech.com.bd/asrock-h310m-hdv-m.2-motherboard,"6,400",Asrock
ASUS H110M-K Motherboard,https://www.startech.com.bd/ASUS-H110M-K-Motherboard,"5,500",ASUS
Asus Prime A320M-K AMD AM4 uATX Motherboard,https://www.startech.com.bd/asus-prime-a320m-k-motherboard,"6,300",Asus
Asus Prime B450-PLUS AMD AM4 ATX Motherboard,https://www.startech.com.bd/asus-prime-b450-plus-motherboard,"10,200",Asus
Asus ROG CROSSHAIR VI HERO AMD X370 ATX Gaming Motherboard,https://www.startech.com.bd/aus-rog-crosshair-vi-hero-motherboard,"22,800",Asus
Gigabyte AMD B450M Gaming Motherboard,https://www.startech.com.bd/gigabyte-amd-b450-gaming-motherboard,"7,500",Gigabyte
Gigabyte GA-B75M-S LGA 1155 Micro-ATX Motherboard,https://www.startech.com.bd/gigabyte-gt-b75m-s-motherboard,"6,200",Gigabyte
Gigabyte GA-H61M-S DDR3 Micro ATX Motherboard,https://www.startech.com.bd/gigabyte-ga-h61m-s-motherboard,"5,700",Gigabyte
Gigabyte GA-H81M-DS2 Micro ATX Motherboard,https://www.startech.com.bd/gigabyte-ga-h81m-ds2-motherboard,"5,300",Gigabyte
ASUS H110M-A Motherboard,https://www.startech.com.bd/ASUS-H110M-A-Motherboard,"5,900",ASUS
ASUS H81M-C Motherboard,https://www.startech.com.bd/asus-h81m-c-motherboard,"5,700",ASUS
Gigabyte GA-B250M-D2V 7th/6th Gen Micro ATX Motherboard,https://www.startech.com.bd/gigabyte-ga-b250m-d2v-motherboard,"6,300",Gigabyte
Asrock B450M Pro4 AMD Motherboard,https://www.startech.com.bd/asrock-b450m-pro4-motherboard,"8,800",Asrock
Asrock Fatal1ty B250M Performance Motherboard,https://www.startech.com.bd/asrock-fatal1ty-b250m-performance,"7,700",Asrock
Asus Tinker Board With Rockchip Quad-Core RK3288 processor,https://www.startech.com.bd/asus-tinker-board,"5,950",Asus
Gigabyte H310M DS2V 8th Gen Motherboard,https://www.startech.com.bd/gigabyte-h310m-ds2v-motherboard,"6,800",Gigabyte
Asrock B360M-HDV 8th Gen DDR4 Motherboard,https://www.startech.com.bd/asrock-b360m-hdv-motherboard,"7,300",Asrock
ASUS H61M-K,https://www.startech.com.bd/asus-h61m-k,"6,400",ASUS
Gigabyte H310M H 8th Gen Micro ATX Motherboard,https://www.startech.com.bd/gigabyte-h310m-h-8th-gen-motherboard,"6,800",Gigabyte
Asrock B450 Steel Legend AMD Motherboard,https://www.startech.com.bd/asrock-b450-steel-legend-motherboard,"11,000",Asrock
Asrock B450M Steel Legend AMD Motherboard,https://www.startech.com.bd/asrock-b450m-steel-legend-motherboard,"9,800",Asrock
Asrock H310M-G/M.2 8th Gen DDR4 Motherboard,https://www.startech.com.bd/asrock-h310m-g-m-2-motherboard,"7,300",Asrock
Asus EX-H310M-V3 8th Gen Micro-ATX Motherboard,https://www.startech.com.bd/asus-ex-h310m-v3-8th-gen-motherboard,"6,700",Asus
Gigabyte H310M S2P 8th Gen Micro ATX Motherboard,https://www.startech.com.bd/gigabyte-h310m-s2p-8th-gen-motherboard,"6,800",Gigabyte
Asus PRIME H310M-K 8th Gen mATX Motherboard,https://www.startech.com.bd/asus-prime-h310m-k-8th-gen-motherboard,"6,700",Asus
Asus ROG MAXIMUS XI FORMULA 9th Gen Motherboard,https://www.startech.com.bd/asus-rog-maximus-xi-formula-9th-gen-motherboard,"40,000",Asus
Gigabyte B450M DS3H AM4 AMD Micro ATX Motherboard,https://www.startech.com.bd/gigabyte-b450m-ds3h-amd-motherboard,"8,000",Gigabyte
GIGABYTE GA-J1800M-D3P Motherboard with Built In 2.41Ghz DDR3 Celeron Processor,https://www.startech.com.bd/gigabyte-ga-j1800m-d3p,"5,100",GIGABYTE
Gigabyte H310M DS2 8th Gen Micro ATX Motherboard,https://www.startech.com.bd/gigabyte-h310m-ds2-8th-gen-motherboard,"7,000",Gigabyte
Asrock B365M Pro4 9th Gen Motherboard,https://www.startech.com.bd/asrock-b365m-pro4-motherboard,"8,700",Asrock
Asrock X370 Killer SLI AMD Motherboard,https://www.startech.com.bd/asrock-x370-killer-sli-amd-motherboard,"9,700",Asrock
Gigabyte GA-H110M-M.2 DDR4,https://www.startech.com.bd/gigabyte-ga-h110m-m.2-ddr4-motherboard,"5,800",Gigabyte
Gigabyte H310M S2 8th Gen Micro ATX Motherboard,https://www.startech.com.bd/gigabyte-h310m-s2-8th-gen-motherboard,"7,000",Gigabyte
Asus PRIME H310M-C/CSM 8th Gen Micro-ATX Motherboard,https://www.startech.com.bd/asus-prime-h310m-c-csm-8th-gen-motherboard,"7,000",Asus
Gigabyte B360M D2V 8th Gen Motherboard,https://www.startech.com.bd/gigabyte-b360m-d2v-motherboard,"7,600",Gigabyte
Asrock Fatal1ty B450 Gaming K4 AMD Motherboard,https://www.startech.com.bd/asrock-fatal1ty-b450-gaming-k4-amd-motherboard,"10,500",Asrock
Gigabyte B360M D3V 8th Gen Motherboard,https://www.startech.com.bd/gigabyte-b360m-d3v-motherboard,"7,800",Gigabyte
ASUS PRIME B250M-K DDR4 ATX Motherboard,https://www.startech.com.bd/asus-prime-b250m-k,"7,150",ASUS
Gigabyte B360M HD3 8th Gen Motherboard,https://www.startech.com.bd/gigabyte-b360m-hd3-motherboard,"8,000",Gigabyte
Gigabyte B450 I AORUS PRO WIFI AMD Mini-ITX Motherboard,https://www.startech.com.bd/gigabyte-b450-i-aorus-pro-wifi-amd-mini-itx-motherboard,"12,500",Gigabyte
ASRock X470 Master SLI ATX AM4 AMD Motherboard,https://www.startech.com.bd/asrock-x470-master-sli-motherboard,"15,500",ASRock
ASUS PRIME B250M-D motherboard,https://www.startech.com.bd/asus-prime-b250m-d-motherboard,"7,500",ASUS
Gigabyte B360M D3H 8th Gen Micro ATX Motherboard,https://www.startech.com.bd/gigabyte-b360m-d3h-8th-gen-micro-atx-motherboard,"8,400",Gigabyte
Asrock Fatal1ty B360 Gaming K4 8th Gen DDR4 Motherboard,https://www.startech.com.bd/asrock-fatal1ty-b360-gaming-k4-motherboard,"9,000",Asrock
Gigabyte B360M-DS3H 8th Gen Motherboard ,https://www.startech.com.bd/gigabyte-b360m-ds3h-motherboard,"8,300",Gigabyte
Asrock B365 Pro4 9th Gen Motherboard,https://www.startech.com.bd/asrock-b365-pro4-motherboard,"9,700",Asrock
ASRock Fatal1ty X370 Gaming-ITX/ac AMD Motherboard,https://www.startech.com.bd/asrock-fatal1ty-x370-itx-ac-motherboard,"17,500",ASRock
ASRock Z390 Pro4 8th and 9th Gen Motherboard ,https://www.startech.com.bd/asrock-z390-pro4-motherboard,"12,000",ASRock
Asus PRIME B360M-K 8th Gen mATX Motherboard,https://www.startech.com.bd/asus-prime-b360m-k-matx-motherboard,"8,250",Asus
Gigabyte B360 HD3 8th Gen DDR4 Motherboard,https://www.startech.com.bd/gigabyte-b360-hd3-motherboard,"9,000",Gigabyte
Gigabyte X470 AORUS GAMING 5 WIFI Motherboard,https://www.startech.com.bd/gigabyte-x470-gaming-5-wifi-motherboard,"17,700",Gigabyte
Gigabyte X470 Aorus Ultra Gaming AM4 AMD Motherboard,https://www.startech.com.bd/gigabyte-x470-aorus-ultra-gaming-motherboard,"14,000",Gigabyte
Asus PRIME B360M-D 8th Gen mATX Motherboard,https://www.startech.com.bd/asus-prime-b360m-d-8th-gen-motherboard,"8,500",Asus
Gigabyte B360M AORUS GAMING 3 8th Gen Motherboard,https://www.startech.com.bd/gigabyte-b360m-aorus-gaming-3-motherboard,"9,500",Gigabyte
Asrock Fatal1ty X470 Gaming K4 AMD Motherboard,https://www.startech.com.bd/asrock-fatal1ty-x470-gaming-k4-motherboard,"18,200",Asrock
ASRock H110 Pro BTC+ DDR4 Motherboard,https://www.startech.com.bd/asrock-h110-pro-btc-plus-motherboard,"12,800",ASRock
Asus TUF B360M-E GAMING 8th Gen mATX Motherboard,https://www.startech.com.bd/asus-tuf-b360m-e-gaming-8th-gen-motherboard,"9,000",Asus
Gigabyte H370M DS3H 8th Gen Micro ATX Motherboard,https://www.startech.com.bd/gigabyte-h370m-ds3h-8th-gen-motherboard,"9,900",Gigabyte
Asus TUF B360M-PLUS Gaming 8th Gen Motherboard,https://www.startech.com.bd/asus-tuf-B360m-plus-motherboard,"10,050",Asus
Gigabyte GA-Gaming B8 Motherboard,https://www.startech.com.bd/gigabyte-ga-gaming-b8,"10,000",Gigabyte
ASRock X470 Taichi ATX AM4 AMD Motherboard,https://www.startech.com.bd/asrock-x470-taichi-motherboard,"22,500",ASRock
Asus PRIME B360-PLUS 8th Gen ATX Motherboard,https://www.startech.com.bd/asus-prime-b360-plus-8th-gen-motherboard,"10,500",Asus
Gigabyte Z370M DS3H Ultra Durable 8th Gen DDR4 Motherboard,https://www.startech.com.bd/gigabyte-z370m-ds3h-motherboard,"10,900",Gigabyte
Asus ROG STRIX B360-G Gaming 8th Gen Motherboard,https://www.startech.com.bd/asus-rog-strix-b360-g-motherboard,"10,600",Asus
Gigabyte H370 HD3 8th Gen Ultra Durable Motherboard,https://www.startech.com.bd/gigabyte-h370-hd3-8th-gen-motherboard,"11,400",Gigabyte
Asrock Fatal1ty X99M Killer/3.1 Motherboard,https://www.startech.com.bd/asrock-fatal1ty-x99m-killer-3.1-motherboard,"17,300",Asrock
Asrock X399 Phantom Gaming 6 AMD Motherboard,https://www.startech.com.bd/asrock-x399-phantom-gaming-6-motherboard,"28,300",Asrock
Asus PRIME H370-PLUS 8th Gen ATX Motherboard,https://www.startech.com.bd/asus-prime-h370-plus-8th-gen-motherboard,"11,500",Asus
Gigabyte B360 Aorus Gaming 3 WiFi 8th Gen DDR4 Motherboard,https://www.startech.com.bd/gigabyte-b360-aorus-gaming-3-wifi-motherboard,"11,200",Gigabyte
Asus ROG STRIX B360-H GAMING 8th Gen ATX Motherboard,https://www.startech.com.bd/asus-rog-strix-b360-h-gaming-motherboard,"11,500",Asus
Gigabyte X299 AORUS Gaming 3 Motherboard,https://www.startech.com.bd/gigabyte-x299-aorus-gaming-3-motherboard,"27,500",Gigabyte
ASRock X399 Taichi USB 3.1 ATX AMD Motherboard,https://www.startech.com.bd/asrock-x399-taichi,"36,600",ASRock
Asrock Z390 Extreme4 9th Gen Atx Motherboard,https://www.startech.com.bd/asrock-z390-extreme4-motherboard,"17,750",Asrock
Asus TUF B360-PRO GAMING (WI-FI) 8th Gen ATX Motherboard,https://www.startech.com.bd/asus-tuf-b360-pro-gaming-wi-fi-motherboard,"12,500",Asus
Gigabyte Z370M D3H Ultra Durable 8th Gen Motherboard,https://www.startech.com.bd/gigabyte-z370m-d3h-8th-gen-motherboard,"12,200",Gigabyte
ASRock Fatal1ty X399 Professional Gaming AMD Motherboard,https://www.startech.com.bd/asrock-x399-gaming-motherboard,"44,600",ASRock
Asrock Z370 Taichi USB 3.1 8th Gen WiFi Motherboard,https://www.startech.com.bd/asrock-z370-taichi-8th-gen-motherboard,"19,500",Asrock
Asus Rog Strix B360-F GAMING 8th Gen Motherboard,https://www.startech.com.bd/asus-rog-strix-b360-f-motherboard,"13,150",Asus
Asus TUF H370-PRO GAMING (WI-FI) 8th Gen ATX Motherboard,https://www.startech.com.bd/asus-tuf-h370-pro-gaming-wi-fI-motherboard,"13,500",Asus
Gigabyte Z370 HD3 Ultra Durable Motherboard ,https://www.startech.com.bd/gigabyte-z370-hd3-motherboard,"13,000",Gigabyte
Asus ROG STRIX B360-I GAMING 8th Gen mini-ITX Motherboard,https://www.startech.com.bd/asus-rog-strix-b360-i-gaming-mini-itx-motherboard,"14,000",Asus
ASUS PRIME Z370-P LGA1151 DDR4 HDMI DVI M.2 ATX Motherboard,https://www.startech.com.bd/asus-prime-z370-p,"14,650",ASUS
Gigabyte H370 AORUS GAMING 3 WIFI 8th Gen Motherboard,https://www.startech.com.bd/gigabyte-h370-aorus-gaming-3-wifi-motherboard,"14,000",Gigabyte
ASRock Fatal1ty X299 Gaming K6 Intel ATX Motherboard ,https://www.startech.com.bd/asrock-fatal1ty-x299-gaming-k6-motherboard,"24,000",ASRock
ASUS PRIME Z390M-PLUS 9th Gen mATX Motherboard,https://www.startech.com.bd/asus-prime-z390m-plus-9th-gen-motherboard,"15,000",ASUS
Asus B250 Mining Expert Intel LGA-1151 ATX DDR4 Motherboard,https://www.startech.com.bd/asus-b250-mining-expert-motherboard,"16,500",Asus
Gigabyte Z370XP SLI Ultra Durable Supports 8th Gen Processors Motherboard ,https://www.startech.com.bd/gigabyte-z370xp-sli-8th-gen-motherboard,"14,500",Gigabyte
ASRock X299 Taichi USB 3.1 ATX Intel Motherboard,https://www.startech.com.bd/asrock-x299-taichi,"31,750",ASRock
Asus TUF Z370-PLUS GAMING II 9th Gen gaming Motherboard,https://www.startech.com.bd/asus-tuf-z370-plus-gaming-II-motherboard,"16,200",Asus
ASUS TUF Z390-PLUS GAMING 9th Gen ATX Gaming Motherboard,https://www.startech.com.bd/asus-tuf-z390-plus-gaming-9th-gen-motherboard,"17,500",ASUS
ASUS TUF Z390M-PRO GAMING 9th Gen mATX Gaming Motherboard,https://www.startech.com.bd/asus-tuf-z390m-pro-gaming-9th-gen-motherboard,"17,500",ASUS
Asus Rog Strix Z370H 8th Gen DDR4 ATX Gaming Motherboard,https://www.startech.com.bd/asus-rog-strix-z370-h-ddr4-motherboard,"17,750",Asus
Gigabyte Z390 Aorus Pro Wifi 9th Gen Motherboard,https://www.startech.com.bd/gigabyte-z390-aorus-pro-wifi-9th-gen-motherboard,"18,600",Gigabyte
Gigabyte Z390 Aorus Xtreme Waterforce Motherboard,https://www.startech.com.bd/z390-aorus-xtreme-waterforce-motherboard,"73,000",Gigabyte
ASUS TUF Z390-PRO GAMING 9th Gen ATX Gaming Motherboard,https://www.startech.com.bd/asus-tuf-z390-pro-gaming-9th-gen-motherboard,"18,000",ASUS
Gigabyte Z390 Aorus Ultra 9th Gen Motherboard,https://www.startech.com.bd/gigabyte-z390-9th-gen-motherboard,"21,800",Gigabyte
AsusTUF Z390-PLUS GAMING (WI-FI) 9th Gen Motherboard,https://www.startech.com.bd/asustuf-z390-plus-wif-motherboard,"18,800",AsusTUF
Asus Rog Strix Z390-H 9th Gen Atx Gaming Motherboard,https://www.startech.com.bd/asus-rog-strix-z390-h-motherboard,"19,300",Asus
ASUS P10S WS Intel C236 Chipset Server Motherboard,https://www.startech.com.bd/asus-p10s-ws-motherboard,"20,100",ASUS
Asus ROG MAXIMUS IX APEX Motherboard,https://www.startech.com.bd/asus-rog-maximus-ix-apex,"28,000",Asus
ASRock A320M-HDV Motherboard,https://www.startech.com.bd/asrock-a320m-hdv,0,ASRock
Asrock B250M-HDV USB 3.1 DDR4 Micro ATX Motherboard,https://www.startech.com.bd/asrock-b250m-hdv-motherboard,"6,300",Asrock
Asrock B365M Phantom Gaming 4 9th Gen Motherboard,https://www.startech.com.bd/asrock-b365m-phantom-gaming-4-motherboard,"9,500",Asrock
Asrock B450M-HDV AMD Motherboard,https://www.startech.com.bd/asrock-b450m-hdv-motherboard,"7,700",Asrock
ASRock Fatal1ty AB350 Gaming K4 Motherboard,https://www.startech.com.bd/asrock-fatal1ty-ab350-gaming-k4,"10,200",ASRock
Asrock Fatal1ty B360M Performance 8th Gen Motherboard,https://www.startech.com.bd/asrock-fatal1ty-b360m-performance-motherboard,"10,300",Asrock
Asrock Fatal1ty H370 Performance 8th Gen DDR4 Motherboard,https://www.startech.com.bd/asrock-fatal1ty-h370-performance-motherboard,"13,400",Asrock
ASRock Fatal1ty X370 Gaming X AMD Motherboard ,https://www.startech.com.bd/asrock-fatal1ty-x370-gaming-x-motherboard,"15,000",ASRock
ASRock Fatal1ty X370 Pro Gaming AMD Motherboard,https://www.startech.com.bd/asrock-fatal1ty-x370-pro-gaming-motherboard,"25,000",ASRock
Asrock H310M-HDV 8th Gen DDR4 Motherboard,https://www.startech.com.bd/asrock-h310M-hdv-motherboard,"6,600",Asrock
Asrock Z370M Pro4 USB 3.1 8th Gen Motherboard ,https://www.startech.com.bd/asrock-z370m-pro4-motherboard,"11,400",Asrock
Asrock Z390 Taichi 9th Gen Atx Motherboard,https://www.startech.com.bd/asrock-z390-taichi-motherboard,"23,100",Asrock
Asus PRIME B360M-A 8th Gen mATX Motherboard,https://www.startech.com.bd/asus-prime-b360m-a-8th-gen-motherboard,"9,250",Asus
Asus PRIME H310M-D 8th Gen mATX Motherboard,https://www.startech.com.bd/asus-prime-h310m-d-8th-gen-motherboard,"7,100",Asus
Asus PRIME H310M-E 8th Gen mATX Motherboard,https://www.startech.com.bd/asus-prime-h310m-e-8th-gen-motherboard,"6,900",Asus
Asus Prime H370-A 8th Gen Motherboard,https://www.startech.com.bd/asus-prime-h370-a-motherboard,"11,500",Asus
Asus Prime J3355I-C DDR3 Mini ITX Motherboard,https://www.startech.com.bd/asus-prime-j3355i-c-motherboard,"5,500",Asus
Asus Prime Z370-A 8th Gen ATX Gaming Motherboard,https://www.startech.com.bd/asus-prime-z370-a-motherboard,"18,600",Asus
Asus Rog Maximus X Code Intel Z370 8th Gen ATX gaming motherboard,https://www.startech.com.bd/asus-rog-maximus-x-code-motherboard,"33,500",Asus
Asus Rog Maximus X Hero WI-FI AC 8th Gen ATX Motherboard,https://www.startech.com.bd/asus-rog-maximus-x-hero-wi-fi-ac-motherboard,"30,000",Asus
Asus ROG MAXIMUS XI CODE Intel Z390 ATX Gaming Motherboard,https://www.startech.com.bd/asus-rog-maximus-xi-code-motherboard,"33,500",Asus
Asus Rog Strix B250F Gaming Motherboard ,https://www.startech.com.bd/asus-rog-strix-b250f,"11,700",Asus
Asus Rog Strix H370-F 8th Gen Gaming Motherboard,https://www.startech.com.bd/asus-rog-strix-h370-f-motherboard,"14,100",Asus
Asus Rog STRIX X299-E Gaming Motherboard,https://www.startech.com.bd/asus-rog-strix-x299-e-motherboard,"31,800",Asus
Asus Rog Strix Z370-E Gaming ATX Motherboard,https://www.startech.com.bd/asus-rog-strix-z370-e-gaming,"22,000",Asus
Asus Rog Strix Z370-F 8th Gen ATX Gaming Motherboard,https://www.startech.com.bd/asus-rog-strix-z370-f,"19,600",Asus
ASUS ROG STRIX Z390-E GAMING 9th Gen ATX Gaming Motherboard,https://www.startech.com.bd/asus-rog-strix-z390-e-gaming-9th-gen-motherboard,"23,200",ASUS
ASUS ROG STRIX Z390-F GAMING 9th Gen ATX Gaming Motherboard,https://www.startech.com.bd/asus-rog-strix-z390-f-gaming,"21,000",ASUS
Asus Rog Z370 Maximus X Hero 8th Gen ATX Motherboard,https://www.startech.com.bd/asus-rog-maximus-x-hero,"27,000",Asus
Asus TUF B450-PLUS GAMING AMD ATX Motherboard,https://www.startech.com.bd/asus-tuf-b450-plus-gaming-amd-motherboard,"11,200",Asus
Asus TUF H310M-PLUS GAMING 8th Gen mATX Motherboard,https://www.startech.com.bd/asus-tuf-h310m-plus-gaming-motherboard,"7,500",Asus
Asus TUF Z370-PLUS 8th Gen ATX Gaming Motherboard ,https://www.startech.com.bd/asus-tuf-z370-plus,"16,300",Asus
Gigabyte AB350M HD3 AMD Motherboard,https://www.startech.com.bd/gigabyte-ab350m-hd3,"7,700",Gigabyte
Gigabyte Aorus Z370 Gaming 3 ATX Motherboard,https://www.startech.com.bd/gigabyte-aorus-z370-gaming-3,"15,500",Gigabyte
Gigabyte Aorus Z370 Gaming 5 ATX Motherboard,https://www.startech.com.bd/gigabyte-aorus-z370-gaming-5,"19,700",Gigabyte
Gigabyte Aorus Z370 Gaming 7 ATX Motherboard,https://www.startech.com.bd/gigabyte-aorus-z370-gaming-7-motherboard,"24,800",Gigabyte
Gigabyte B450 AORUS PRO AM4 AMD ATX Motherboard,https://www.startech.com.bd/gigabyte-b450-aorus-pro-amd-motherboard,"11,500",Gigabyte
Gigabyte B450 AORUS PRO WIFI AMD ATX Motherboard,https://www.startech.com.bd/gigabyte-b450-aorus-pro-wifi-motherboard,"12,100",Gigabyte
Gigabyte GA-A320M-HD2 AMD Micro ATX Motherboard,https://www.startech.com.bd/gigabyte-ga-a320m-hd2-amd-motherboard,"5,750",Gigabyte
Gigabyte GA-AB350M-D3H AMD Micro ATX Motherboard,https://www.startech.com.bd/gigabyte-ga-ab350m-d3h-amd-motherboard,"7,900",Gigabyte
Gigabyte GA-B250M-D3H Motherboard,https://www.startech.com.bd/gigabyte-ga-b250m-d3h,"7,700",Gigabyte
Gigabyte GA-B250M-HD3 Motherboard,https://www.startech.com.bd/gigabyte-ga-b250m-hd3,"6,900",Gigabyte
Gigabyte GA-H110M-H Micro ATX Motherboard,https://www.startech.com.bd/gigabyte-ga-h110m-h-motherboard,"5,500",Gigabyte
Gigabyte GA-H110M-S2 Micro ATX Motherboard,https://www.startech.com.bd/gigabyte-ga-h110m-s2-micro-atx-motherboard,"5,400",Gigabyte
Gigabyte GA-H61M-DS2 Motherboard,https://www.startech.com.bd/gigabyte-ga-h61m-ds2,"6,000",Gigabyte
GIGABYTE GA-H81M-S2PV,https://www.startech.com.bd/gigabyte-ga-h81m-s2pv,"5,000",GIGABYTE
Gigabyte H370M D3H Ultra Durable 8th Gen Motherboard,https://www.startech.com.bd/gigabyte-h370m-d3h-motherboard,"10,700",Gigabyte
Gigabyte H370N WIFI 8th Gen Mini-ITX Motherboard,https://www.startech.com.bd/gigabyte-h370n-wifi-8th-gen-motherboard,"10,500",Gigabyte
Gigabyte H61M S2PH Motherboard,https://www.startech.com.bd/gigabyte-h61m-s2ph-motherboard,"5,800",Gigabyte
Gigabyte X299 AORUS Gaming 7 Motherboard,https://www.startech.com.bd/x299-aorus-gaming-7-motherboard,"44,000",Gigabyte
Gigabyte X299 Ultra Durable Motherboard ,https://www.startech.com.bd/gigabyte-x299-ud4-motherboard,"24,000",Gigabyte
Gigabyte X399 AORUS Gaming 7 AMD ATX Motherboard,https://www.startech.com.bd/gigabyte-x399-aorus-gaming-7-motherboard,"39,500",Gigabyte
Gigabyte X470 AORUS GAMING 7 WIFI AM4 AMD ATX Motherboard,https://www.startech.com.bd/gigabyte-x470-aorus-gaming-7-amd-motherboard,"22,500",Gigabyte
Gigabyte Z370N WiFi Ultra Durable 8th Gen Motherboard,https://www.startech.com.bd/gigabyte-z370n-wifi-motherboard,"14,000",Gigabyte
Gigabyte Z390 Aorus Master 9th Gen Motherboard,https://www.startech.com.bd/gigabyte-z390-aorus-master-motherboard,"23,900",Gigabyte
Gigabyte Z390 GAMING SLI 9th Gen ATX Motherboard,https://www.startech.com.bd/gigabyte-z390-gaming-sli-9th-gen-motherboard,"14,800",Gigabyte
Gigabyte Z390 GAMING X 9th Gen ATX Motherboard,https://www.startech.com.bd/gigabyte-z390-gaming-x-9th-gen-motherboard,"14,100",Gigabyte
MSI B250 KRAIT GAMING Motherboard,https://www.startech.com.bd/msi-b250-krait-gaming,"10,200",MSI
MSI B360 Gaming Plus 8th Gen DDR4 Motherboard,https://www.startech.com.bd/msi-b360-gaming-plus-motherboard,"11,500",MSI
MSI B360M Mortar 8th Gen DDR4 Motherboard,https://www.startech.com.bd/msi-b360m-mortar-motherboard,"10,500",MSI
MSI H370 Gaming Pro Carbon 8th Gen DDR4 Motherboard,https://www.startech.com.bd/msi-h370-gaming-pro-carbon-motherboard,"15,200",MSI
MSI H370m Bazooka 8th Gen DDR4 Motherboard,https://www.startech.com.bd/msi-h370m-bazooka-motherboard,"12,700",MSI
Asus Prime X399-A AMD Motherboard,https://www.startech.com.bd/asus-prime-x399-a-motherboard,"29,900",Asus
Gigabyte B450 AORUS M AMD Micro ATX Motherboard,https://www.startech.com.bd/gigabyte-b450-aorus-m-amd-motherboard,"9,900",Gigabyte
